{
  "artifact_operation_id": "11111111-1111-4111-8111-111111111111",
  "billing_request_id": "vibe-article:7:original-request",
  "channel": "cms",
  "company_id": "22222222-2222-4222-8222-222222222222",
  "connection_generation": 1,
  "connection_id": "33333333-3333-4333-8333-333333333333",
  "digest": "5ab8deb94be825cc2e343b7aa5c06a5d39cfdad916753bd3d5801949c9e1b560",
  "kind": "publishing_channel_artifact",
  "organization_id": "7",
  "owner_user_id": "4",
  "platform": "wordpress",
  "policy_sha256": "bbbbbbbbbbbbbbbbbbbbbbbbbbbbbbbbbbbbbbbbbbbbbbbbbbbbbbbbbbbbbbbb",
  "public_origin": "https://fixture.test/blog/",
  "review_policy": "review",
  "schema_version": 1,
  "scope_sha256": "aaaaaaaaaaaaaaaaaaaaaaaaaaaaaaaaaaaaaaaaaaaaaaaaaaaaaaaaaaaaaaaa"
}
